{"name":"PasswordInput","displayName":"PasswordInput","category":"atom","description":"PasswordInput component for password fields with visibility toggle. Extends MUI TextField with password-specific features including a show/hide toggle button.","muiComponent":"TextField","muiPackage":"@mui/material","props":[{"name":"label","type":"string","required":false,"description":"Label for the input"},{"name":"value","type":"string","required":false,"description":"The value of the input"},{"name":"onChange","type":"function","required":false,"description":"Change handler"},{"name":"disabled","type":"boolean","required":false,"description":"If true, the input will be disabled"},{"name":"required","type":"boolean","required":false,"description":"If true, the input is required"},{"name":"error","type":"boolean","required":false,"description":"If true, the input will indicate an error"},{"name":"helperText","type":"string","required":false,"description":"Helper text displayed below the input"},{"name":"placeholder","type":"string","required":false,"description":"Placeholder text"},{"name":"showVisibilityToggle","type":"boolean","required":false,"defaultValue":true,"description":"If true, password visibility toggle is shown"}],"examples":[{"title":"Basic","description":"Basic password input","code":"import { PasswordInput } from '@/components';\n\n<PasswordInput label=\"Password\" />"}],"migrationExamples":[{"mui":"import { TextField } from '@mui/material';\n<TextField type=\"password\" label=\"Password\" />","designSystem":"import { PasswordInput } from '@/components';\n<PasswordInput label=\"Password\" />","description":"Replace MUI TextField type=\"password\" with PasswordInput for built-in visibility toggle and consistent styling."}],"relatedComponents":["Input","Search"],"accessibility":{"ariaAttributes":["aria-label","aria-required","aria-invalid"],"keyboardNavigation":"Tab to input, Tab to visibility toggle button","screenReaderNotes":"Visibility toggle button announces current state"},"usageGuidelines":{"whenToUse":["Password fields in login forms","New password entry","Password confirmation fields"],"whenNotToUse":["For regular text input (use Input instead)","For PIN entry"],"bestPractices":["Always include a label","Show/hide toggle improves usability","Use error and helperText for validation feedback"],"commonPatterns":["Login form password field","Registration form with password confirmation"]},"importPath":"@/components/atoms/PasswordInput","exportPath":"@/components"}
