{"name":"Link","displayName":"Link","category":"atom","description":"Link component for navigation. Extends MUI Link with custom styling.","muiComponent":"Link","muiPackage":"@mui/material","props":[{"name":"children","type":"React.ReactNode","required":true,"description":"The content of the link"},{"name":"href","type":"string","required":false,"description":"The URL to link to"},{"name":"color","type":"'inherit' | 'primary' | 'secondary' | 'error' | 'info' | 'success' | 'warning'","required":false,"description":"Color of the link"},{"name":"underline","type":"'none' | 'hover' | 'always'","required":false,"description":"Underline behavior"},{"name":"target","type":"string","required":false,"description":"If set, opens in a new tab"},{"name":"onClick","type":"function","required":false,"description":"Click handler"}],"examples":[{"title":"Basic","description":"Basic link usage","code":"import { Link } from '@/components';\n\n<Link href=\"/about\">About Us</Link>"}],"migrationExamples":[{"mui":"import { Link } from '@mui/material';\n<Link href=\"/about\">About</Link>","designSystem":"import { Link } from '@/components';\n<Link href=\"/about\">About</Link>","description":"Replace MUI Link with design system Link. Same API with custom styling."}],"relatedComponents":["Button","Breadcrumbs"],"accessibility":{"ariaAttributes":["aria-label","aria-current"],"keyboardNavigation":"Enter activates the link","screenReaderNotes":"Link destination and target behavior announced"},"usageGuidelines":{"whenToUse":["Navigation within text","Breadcrumb links","External resource links"],"whenNotToUse":["For action triggers (use Button with variant='text' instead)","For navigation buttons"],"bestPractices":["Use descriptive link text","Indicate external links with target='_blank' and rel='noopener'","Use underline='hover' for cleaner appearance"],"commonPatterns":["Inline text link","Breadcrumb navigation link"]},"importPath":"@/components/atoms/Link","exportPath":"@/components"}
