{"name":"Radio","displayName":"Radio","category":"atom","description":"Radio component for single selection from a group. Only one radio in a group can be selected at a time. Extends MUI Radio with custom styling.","muiComponent":"Radio","muiPackage":"@mui/material","props":[{"name":"checked","type":"boolean","required":false,"description":"If true, the component is checked"},{"name":"disabled","type":"boolean","required":false,"description":"If true, the component will be disabled"},{"name":"color","type":"'default' | 'primary' | 'secondary' | 'error' | 'info' | 'success' | 'warning'","required":false,"description":"Color of the radio"},{"name":"size","type":"'small' | 'medium'","required":false,"description":"Size of the radio"},{"name":"value","type":"string","required":false,"description":"The value of the component"},{"name":"onChange","type":"function","required":false,"description":"Change handler"}],"examples":[{"title":"Basic","description":"Radio in a group","code":"import { Radio, RadioGroup, FormControlLabel } from '@/components';\n\n<RadioGroup value=\"option1\">\n  <FormControlLabel value=\"option1\" control={<Radio />} label=\"Option 1\" />\n  <FormControlLabel value=\"option2\" control={<Radio />} label=\"Option 2\" />\n</RadioGroup>"}],"migrationExamples":[{"mui":"import { Radio } from '@mui/material';\n<Radio value=\"option1\" />","designSystem":"import { Radio } from '@/components';\n<Radio value=\"option1\" />","description":"Replace MUI Radio with design system Radio. Use within RadioGroup for proper behavior."}],"relatedComponents":["Checkbox","Toggle","SegmentedControl"],"accessibility":{"ariaAttributes":["aria-checked","aria-label","role=\"radio\""],"keyboardNavigation":"Arrow keys navigate between radios in a group, Space selects","screenReaderNotes":"Radio label, checked state, and group context are announced"},"usageGuidelines":{"whenToUse":["Single selection from 2-5 options","When all options should be visible","Form selections requiring one choice"],"whenNotToUse":["For multiple selections (use Checkbox instead)","For binary on/off (use Toggle instead)","For many options (use Dropdown instead)"],"bestPractices":["Always use within a RadioGroup","Provide labels for each option","Use a group label for the set"],"commonPatterns":["Form radio group with labels","Settings selection"]},"importPath":"@/components/atoms/Radio","exportPath":"@/components"}
