{"name":"IconButton","displayName":"IconButton","category":"atom","description":"IconButton component for icon-only buttons. Extends MUI IconButton with custom styling.","muiComponent":"IconButton","muiPackage":"@mui/material","props":[{"name":"children","type":"React.ReactNode","required":true,"description":"The icon to display"},{"name":"color","type":"'default' | 'primary' | 'secondary' | 'error' | 'info' | 'success' | 'warning' | 'inherit'","required":false,"description":"Color of the icon button"},{"name":"size","type":"'small' | 'medium' | 'large'","required":false,"description":"Size of the icon button"},{"name":"disabled","type":"boolean","required":false,"description":"If true, the button will be disabled"},{"name":"onClick","type":"function","required":false,"description":"Click handler"},{"name":"edge","type":"'start' | 'end' | false","required":false,"description":"If true, the button will use edge padding"}],"examples":[{"title":"Basic","description":"Basic icon button","code":"import { IconButton } from '@/components';\nimport CloseIcon from '@mui/icons-material/Close';\n\n<IconButton aria-label=\"Close\" onClick={() => {}}>\n  <CloseIcon />\n</IconButton>"}],"migrationExamples":[{"mui":"import { IconButton } from '@mui/material';\nimport CloseIcon from '@mui/icons-material/Close';\n<IconButton><CloseIcon /></IconButton>","designSystem":"import { IconButton } from '@/components';\nimport CloseIcon from '@mui/icons-material/Close';\n<IconButton aria-label=\"Close\"><CloseIcon /></IconButton>","description":"Replace MUI IconButton with design system IconButton. Always provide aria-label for accessibility."}],"relatedComponents":["Button","Icon","Tooltip"],"accessibility":{"ariaAttributes":["aria-label"],"keyboardNavigation":"Enter or Space activates the button","screenReaderNotes":"Always provide aria-label since there is no visible text"},"usageGuidelines":{"whenToUse":["Icon-only actions","Toolbar buttons","Close buttons","Settings/menu triggers"],"whenNotToUse":["For actions with text labels (use Button instead)","For non-interactive icons (use Icon instead)"],"bestPractices":["Always provide aria-label for accessibility","Use Tooltip to provide context on hover","Use edge prop for alignment in toolbars"],"commonPatterns":["Close button in dialog","Edit/delete action buttons","Navigation toggle button"]},"importPath":"@/components/atoms/IconButton","exportPath":"@/components"}
