{"name":"Search","displayName":"Search","category":"atom","description":"Search component for search input fields with icon. Extends MUI TextField with search-specific features including a search icon and Enter key handler.","muiComponent":"TextField","muiPackage":"@mui/material","props":[{"name":"label","type":"string","required":false,"description":"Label for the search input"},{"name":"value","type":"string","required":false,"description":"The value of the search input"},{"name":"onChange","type":"function","required":false,"description":"Change handler"},{"name":"onSearch","type":"(value: string) => void","required":false,"description":"Callback fired when search is performed on Enter key or icon click"},{"name":"disabled","type":"boolean","required":false,"description":"If true, the input will be disabled"},{"name":"required","type":"boolean","required":false,"description":"If true, the input is required"},{"name":"placeholder","type":"string","required":false,"description":"Placeholder text"},{"name":"showSearchIcon","type":"boolean","required":false,"defaultValue":true,"description":"If true, shows the search icon"}],"examples":[{"title":"Basic","description":"Basic search input","code":"import { Search } from '@/components';\n\n<Search placeholder=\"Search...\" onSearch={(value) => console.log(value)} />"}],"migrationExamples":[{"mui":"import { TextField } from '@mui/material';\n<TextField placeholder=\"Search\" />","designSystem":"import { Search } from '@/components';\n<Search placeholder=\"Search\" onSearch={(value) => handleSearch(value)} />","description":"Replace MUI TextField for search with Search component for built-in search icon and onSearch callback."}],"relatedComponents":["Input","Typeahead"],"accessibility":{"ariaAttributes":["aria-label","role=\"search\""],"keyboardNavigation":"Enter triggers search, standard text input navigation","screenReaderNotes":"Search field purpose and search icon are announced"},"usageGuidelines":{"whenToUse":["Global search bars","Table/list filtering","Content search"],"whenNotToUse":["For autocomplete with suggestions (use Typeahead instead)","For regular text input (use Input instead)"],"bestPractices":["Provide a meaningful placeholder","Handle search on Enter key press","Consider debouncing onChange for performance"],"commonPatterns":["Header search bar","Table filter search","Page content search"]},"importPath":"@/components/atoms/Search","exportPath":"@/components"}
