{"name":"Logo","displayName":"Logo","category":"atom","description":"Logo component for displaying application or brand logos. Supports both image URLs and custom content.","props":[{"name":"src","type":"string","required":false,"description":"The source URL of the logo image"},{"name":"alt","type":"string","required":false,"defaultValue":"Logo","description":"Alt text"},{"name":"width","type":"number | string","required":false,"description":"Width of the logo"},{"name":"height","type":"number | string","required":false,"description":"Height of the logo"},{"name":"children","type":"React.ReactNode","required":false,"description":"Custom logo content such as text or SVG"},{"name":"onClick","type":"function","required":false,"description":"Click handler"}],"examples":[{"title":"Basic","description":"Logo with image","code":"import { Logo } from '@/components';\n\n<Logo src=\"/logo.svg\" alt=\"Company Logo\" />"}],"relatedComponents":["Avatar"],"accessibility":{"ariaAttributes":["aria-label"],"keyboardNavigation":"Clickable if onClick provided","screenReaderNotes":"Alt text describes the logo"},"usageGuidelines":{"whenToUse":["Application branding","Navigation header logos","Login/splash screens"],"whenNotToUse":["For user avatars (use Avatar instead)","For decorative images"],"bestPractices":["Always provide alt text","Use appropriate dimensions for the context","Provide both expanded and collapsed variants for responsive layouts"],"commonPatterns":["Navigation header with logo","Login page branding"]},"importPath":"@/components/atoms/Logo","exportPath":"@/components"}
